{
  "$schema": "./legacy-content-migration-matrix.schema.json",
  "schemaVersion": 1,
  "matrixId": "sskem-legacy-content-migration",
  "builtOn": "2026-09-07",
  "archive": {
    "id": "SSKEMS-BACKUP-2026-08-29",
    "capturedOn": "2026-08-29",
    "sitemapSha256": "f6b52dbcd9ef2cfc3138e64b79244c4dee25b02140b12683e5facbe363cc90a4",
    "checksumManifestSha256": "68e0024228f2edb28f99b34fe30ad83a32369931eb1624cf811a0e3e5cc30b48",
    "expectedRecords": 115,
    "expectedPublicRecords": 108,
    "expectedPrivateRecords": 7
  },
  "policy": {
    "legacyContentIsApprovalEvidence": false,
    "privateSourceDetailsStored": false,
    "decisionsPreselected": false,
    "downloadPersistsChanges": false,
    "publicPublicationAllowed": false,
    "notes": "This matrix accounts for archived records without copying content or evidence. Every route, content, approval and implementation decision remains explicit and fail closed."
  },
  "records": [
    {
      "id": "migration-732d9eec031f3e31",
      "label": "Activities 2016",
      "sourceRef": "archive-content-732d9eec031f3e31",
      "sourceDigest": "c35fa7f64b1e39673de3f976aba9d544edb7d8816e33753da59526e9594e0399",
      "sourceKind": "category",
      "sourceVisibility": "public",
      "sourceStatus": "public-index",
      "sourceModifiedOn": null,
      "area": "taxonomy",
      "identityProtected": false,
      "legacyPath": "/category/activities-2016",
      "routeContinuity": {
        "status": "decision-required",
        "action": "unselected",
        "targetPath": null,
        "cutoverRecordId": null
      },
      "requiredReviews": [
        "accuracy",
        "currency",
        "editorial",
        "management-approval"
      ],
      "contentDecision": {
        "decision": "unselected",
        "targetPath": null,
        "mergeIntoRecordId": null,
        "rationale": null,
        "ownerRole": null,
        "reviewedOn": null
      },
      "implementationStatus": "not-started",
      "publicationEligible": false,
      "publicationReason": "decision-and-approval-required"
    },
    {
      "id": "migration-32c060053d25e1b5",
      "label": "Lunch",
      "sourceRef": "archive-content-32c060053d25e1b5",
      "sourceDigest": "54f8cbf99a9e66f5298aa5681c0fa6b47356cbdb56a2746c4f981a204fece29d",
      "sourceKind": "category",
      "sourceVisibility": "public",
      "sourceStatus": "public-index",
      "sourceModifiedOn": null,
      "area": "taxonomy",
      "identityProtected": false,
      "legacyPath": "/category/lunch",
      "routeContinuity": {
        "status": "decision-required",
        "action": "unselected",
        "targetPath": null,
        "cutoverRecordId": null
      },
      "requiredReviews": [
        "accuracy",
        "currency",
        "editorial",
        "management-approval"
      ],
      "contentDecision": {
        "decision": "unselected",
        "targetPath": null,
        "mergeIntoRecordId": null,
        "rationale": null,
        "ownerRole": null,
        "reviewedOn": null
      },
      "implementationStatus": "not-started",
      "publicationEligible": false,
      "publicationReason": "decision-and-approval-required"
    },
    {
      "id": "migration-ad5ee72ea935364d",
      "label": "School life",
      "sourceRef": "archive-content-ad5ee72ea935364d",
      "sourceDigest": "b0cdc0e79b2d77fe0f2bb4f83d327c043c1e2d95878d49e074c0f77a8b6e127f",
      "sourceKind": "category",
      "sourceVisibility": "public",
      "sourceStatus": "public-index",
      "sourceModifiedOn": null,
      "area": "taxonomy",
      "identityProtected": false,
      "legacyPath": "/category/school-life",
      "routeContinuity": {
        "status": "decision-required",
        "action": "unselected",
        "targetPath": null,
        "cutoverRecordId": null
      },
      "requiredReviews": [
        "accuracy",
        "currency",
        "editorial",
        "management-approval"
      ],
      "contentDecision": {
        "decision": "unselected",
        "targetPath": null,
        "mergeIntoRecordId": null,
        "rationale": null,
        "ownerRole": null,
        "reviewedOn": null
      },
      "implementationStatus": "not-started",
      "publicationEligible": false,
      "publicationReason": "decision-and-approval-required"
    },
    {
      "id": "migration-4806caba914dfeaa",
      "label": "Uncategorized",
      "sourceRef": "archive-content-4806caba914dfeaa",
      "sourceDigest": "1b0165235c29550d4a8eafffbe80a56fe7b868fc491c7f1d3aa5dad2db871b70",
      "sourceKind": "category",
      "sourceVisibility": "public",
      "sourceStatus": "public-index",
      "sourceModifiedOn": null,
      "area": "taxonomy",
      "identityProtected": false,
      "legacyPath": "/category/uncategorized",
      "routeContinuity": {
        "status": "decision-required",
        "action": "unselected",
        "targetPath": null,
        "cutoverRecordId": null
      },
      "requiredReviews": [
        "accuracy",
        "currency",
        "editorial",
        "management-approval"
      ],
      "contentDecision": {
        "decision": "unselected",
        "targetPath": null,
        "mergeIntoRecordId": null,
        "rationale": null,
        "ownerRole": null,
        "reviewedOn": null
      },
      "implementationStatus": "not-started",
      "publicationEligible": false,
      "publicationReason": "decision-and-approval-required"
    },
    {
      "id": "migration-8a8cfc64190a0285",
      "label": "Home",
      "sourceRef": "archive-content-8a8cfc64190a0285",
      "sourceDigest": "6b0d8cb3e8948ac74a1752973986add7f35ccc547c32a04859d1bf7687fc09b4",
      "sourceKind": "page",
      "sourceVisibility": "public",
      "sourceStatus": "publish",
      "sourceModifiedOn": "2026-06-18T09:17:18",
      "area": "home",
      "identityProtected": false,
      "legacyPath": "/",
      "routeContinuity": {
        "status": "implemented",
        "action": "retain",
        "targetPath": "/",
        "cutoverRecordId": "legacy-home"
      },
      "requiredReviews": [
        "accuracy",
        "currency",
        "editorial",
        "management-approval"
      ],
      "contentDecision": {
        "decision": "unselected",
        "targetPath": null,
        "mergeIntoRecordId": null,
        "rationale": null,
        "ownerRole": null,
        "reviewedOn": null
      },
      "implementationStatus": "not-started",
      "publicationEligible": false,
      "publicationReason": "decision-and-approval-required"
    },
    {
      "id": "migration-5bd82d2a895ec993",
      "label": "About Us",
      "sourceRef": "archive-content-5bd82d2a895ec993",
      "sourceDigest": "30a73497ca1a9b2d9fb2fa7ae832f868d9a062cb2300f8127ea638ab1fca5605",
      "sourceKind": "page",
      "sourceVisibility": "public",
      "sourceStatus": "publish",
      "sourceModifiedOn": "2018-12-24T07:35:05",
      "area": "about",
      "identityProtected": false,
      "legacyPath": "/about-us",
      "routeContinuity": {
        "status": "decision-required",
        "action": "unselected",
        "targetPath": null,
        "cutoverRecordId": null
      },
      "requiredReviews": [
        "accuracy",
        "currency",
        "editorial",
        "management-approval"
      ],
      "contentDecision": {
        "decision": "unselected",
        "targetPath": null,
        "mergeIntoRecordId": null,
        "rationale": null,
        "ownerRole": null,
        "reviewedOn": null
      },
      "implementationStatus": "not-started",
      "publicationEligible": false,
      "publicationReason": "decision-and-approval-required"
    },
    {
      "id": "migration-d48577eec84a1738",
      "label": "Chairman Message",
      "sourceRef": "archive-content-d48577eec84a1738",
      "sourceDigest": "505378d243397e9b6cb3644276a797d5f19ffb8590a1eea45023fb245cf741a2",
      "sourceKind": "page",
      "sourceVisibility": "public",
      "sourceStatus": "publish",
      "sourceModifiedOn": "2021-04-19T08:57:48",
      "area": "about",
      "identityProtected": false,
      "legacyPath": "/about-us/chairman-message",
      "routeContinuity": {
        "status": "implemented",
        "action": "redirect",
        "targetPath": "/about/leadership",
        "cutoverRecordId": "legacy-chairman-message"
      },
      "requiredReviews": [
        "accuracy",
        "currency",
        "editorial",
        "management-approval"
      ],
      "contentDecision": {
        "decision": "unselected",
        "targetPath": null,
        "mergeIntoRecordId": null,
        "rationale": null,
        "ownerRole": null,
        "reviewedOn": null
      },
      "implementationStatus": "not-started",
      "publicationEligible": false,
      "publicationReason": "decision-and-approval-required"
    },
    {
      "id": "migration-beb7efe0fa999ead",
      "label": "President Message",
      "sourceRef": "archive-content-beb7efe0fa999ead",
      "sourceDigest": "d38321681efaba0fff81d77636fbc9221d0d5ae0a5ec771b27439e3de4872965",
      "sourceKind": "page",
      "sourceVisibility": "public",
      "sourceStatus": "publish",
      "sourceModifiedOn": "2021-04-19T08:59:11",
      "area": "about",
      "identityProtected": false,
      "legacyPath": "/about-us/president-message-2",
      "routeContinuity": {
        "status": "implemented",
        "action": "redirect",
        "targetPath": "/about/leadership",
        "cutoverRecordId": "legacy-president-message"
      },
      "requiredReviews": [
        "accuracy",
        "currency",
        "editorial",
        "management-approval"
      ],
      "contentDecision": {
        "decision": "unselected",
        "targetPath": null,
        "mergeIntoRecordId": null,
        "rationale": null,
        "ownerRole": null,
        "reviewedOn": null
      },
      "implementationStatus": "not-started",
      "publicationEligible": false,
      "publicationReason": "decision-and-approval-required"
    },
    {